{
  "$schema": "https://json-schema.org/draft/2020-12/schema",
  "$id": "https://github.com/weigefenxiang/WeiG-OpenWrt-AutoBuild/site/wrt/config/site.schema.json",
  "title": "WeiG OpenWrt AutoBuild site configuration",
  "type": "object",
  "additionalProperties": false,
  "required": ["project", "catalog", "ui", "firmware", "build"],
  "properties": {
    "project": {
      "$ref": "#/$defs/project"
    },
    "catalog": {
      "$ref": "#/$defs/catalog"
    },
    "ui": {
      "$ref": "#/$defs/ui"
    },
    "firmware": {
      "$ref": "#/$defs/firmware"
    },
    "build": {
      "$ref": "#/$defs/build"
    }
  },
  "$defs": {
    "project": {
      "type": "object",
      "additionalProperties": false,
      "required": ["displayName", "shortName", "repository", "blogUrl"],
      "properties": {
        "displayName": {
          "type": "string",
          "minLength": 1,
          "maxLength": 96
        },
        "shortName": {
          "type": "string",
          "minLength": 1,
          "maxLength": 64,
          "pattern": "^[\\p{L}\\p{N}\\p{M}][\\p{L}\\p{N}\\p{M} ._+@()\\-]*$"
        },
        "repository": {
          "$ref": "#/$defs/repository"
        },
        "guideUrl": {
          "description": "Optional Fork guide URL; omitted or empty values retain the repository guide fallback.",
          "anyOf": [
            { "const": "" },
            { "type": "string", "pattern": "^https://[^\\s/?#]+(?:/[^\\s?#]*)?(?:\\?[^\\s#]*)?(?:#\\S*)?$" }
          ]
        },
        "blogUrl": {
          "anyOf": [
            {
              "const": ""
            },
            {
              "type": "string",
              "pattern": "^https://[^\\s/?#]+(?:/[^\\s?#]*)?(?:\\?[^\\s#]*)?(?:#\\S*)?$"
            }
          ]
        }
      }
    },
    "catalog": {
      "type": "object",
      "additionalProperties": false,
      "required": ["repository", "selection", "loading"],
      "properties": {
        "repository": {
          "$ref": "#/$defs/repository"
        },
        "selection": {
          "type": "object",
          "additionalProperties": false,
          "required": ["sourcePriority", "defaultSource", "developmentBranches", "preferredTarget"],
          "properties": {
            "sourcePriority": {
              "type": "array",
              "minItems": 1,
              "uniqueItems": true,
              "items": {
                "$ref": "#/$defs/identifier"
              }
            },
            "defaultSource": {
              "$ref": "#/$defs/identifier"
            },
            "developmentBranches": {
              "type": "array",
              "minItems": 1,
              "uniqueItems": true,
              "items": {
                "$ref": "#/$defs/branch"
              }
            },
            "preferredTarget": {
              "type": "object",
              "additionalProperties": false,
              "required": ["selectors"],
              "properties": {
                "selectors": {
                  "type": "object",
                  "additionalProperties": false,
                  "required": ["system", "subtarget", "profile"],
                  "properties": {
                    "system": {
                      "$ref": "#/$defs/symbol"
                    },
                    "subtarget": {
                      "$ref": "#/$defs/symbol"
                    },
                    "profile": {
                      "$ref": "#/$defs/symbol"
                    }
                  }
                }
              }
            }
          }
        },
        "loading": {
          "type": "object",
          "additionalProperties": false,
          "required": ["startup", "idle", "startupConcurrency", "idleConcurrency", "idleDelayMs"],
          "properties": {
            "startup": {
              "type": "array",
              "minItems": 1,
              "uniqueItems": true,
              "items": {
                "$ref": "#/$defs/task"
              }
            },
            "idle": {
              "type": "array",
              "minItems": 1,
              "uniqueItems": true,
              "items": {
                "$ref": "#/$defs/task"
              }
            },
            "startupConcurrency": {
              "type": "integer",
              "minimum": 1,
              "maximum": 16
            },
            "idleConcurrency": {
              "type": "integer",
              "minimum": 1,
              "maximum": 16
            },
            "idleDelayMs": {
              "type": "integer",
              "minimum": 0,
              "maximum": 60000
            }
          }
        }
      }
    },
    "ui": {
      "type": "object",
      "additionalProperties": false,
      "required": ["defaultLanguage", "colorMode"],
      "properties": {
        "defaultLanguage": {
          "enum": ["auto"],
          "$comment": "Retained for configuration compatibility; the browser chooses the language from navigator.languages and falls back to English when unmatched."
        },
        "colorMode": {
          "enum": ["auto", "light", "dark"]
        },
        "applicationCountAdvisory": {
          "description": "Optional non-blocking count policy for additional final-Y applications, not a capacity estimate.",
          "type": "object",
          "additionalProperties": false,
          "required": ["warningAbove", "dangerAbove"],
          "properties": {
            "warningAbove": { "type": "integer", "minimum": 0, "maximum": 10000 },
            "dangerAbove": { "type": "integer", "minimum": 1, "maximum": 10000 }
          }
        }
      }
    },
    "firmware": {
      "type": "object",
      "additionalProperties": false,
      "required": ["lanIp", "timezone", "theme", "ntp", "packageMirror"],
      "properties": {
        "lanIp": {
          "type": "string",
          "pattern": "^(?:(?:10|192\\.168)\\.(?:25[0-5]|2[0-4][0-9]|1[0-9]{2}|[1-9]?[0-9])\\.(?:25[0-5]|2[0-4][0-9]|1[0-9]{2}|[1-9]?[0-9])|172\\.(?:1[6-9]|2[0-9]|3[01])\\.(?:25[0-5]|2[0-4][0-9]|1[0-9]{2}|[1-9]?[0-9])\\.(?:25[0-5]|2[0-4][0-9]|1[0-9]{2}|[1-9]?[0-9]))$"
        },
        "timezone": {
          "type": "object",
          "additionalProperties": false,
          "required": ["zonename", "timezone"],
          "properties": {
            "zonename": {
              "type": "string",
              "pattern": "^[A-Za-z0-9._+-]+(?:/[A-Za-z0-9._+-]+)+$"
            },
            "timezone": {
              "type": "string",
              "pattern": "^[A-Za-z0-9._+<>,:/-]{1,128}$"
            }
          },
          "$comment": "The pair must match one exact row in site/wrt/data/timezones.json."
        },
        "theme": {
          "type": "string",
          "pattern": "^luci-theme-[A-Za-z0-9._+-]{1,48}$"
        },
        "ntp": {
          "type": "object",
          "additionalProperties": false,
          "required": ["preset", "servers"],
          "properties": {
            "preset": {
              "enum": ["cn", "global", "cloudflare"]
            },
            "servers": {
              "type": "array",
              "minItems": 4,
              "maxItems": 4,
              "uniqueItems": true,
              "items": {
                "$ref": "#/$defs/hostname"
              }
            }
          }
        },
        "packageMirror": {
          "$ref": "#/$defs/identifier",
          "$comment": "Must match a canonical preset id in config/policies/package-mirrors.json; aliases are not accepted."
        }
      }
    },
    "build": {
      "type": "object",
      "additionalProperties": false,
      "required": ["defaultTag"],
      "properties": {
        "defaultTag": {
          "type": "string",
          "maxLength": 160
        }
      }
    },
    "repository": {
      "type": "string",
      "pattern": "^[A-Za-z0-9_.-]+/[A-Za-z0-9_.-]+$"
    },
    "identifier": {
      "type": "string",
      "pattern": "^[A-Za-z0-9][A-Za-z0-9._-]{0,95}$"
    },
    "branch": {
      "type": "string",
      "pattern": "^[A-Za-z0-9][A-Za-z0-9._/-]{0,159}$"
    },
    "symbol": {
      "type": "string",
      "pattern": "^[A-Za-z0-9_+@./-]{1,160}$"
    },
    "task": {
      "type": "string",
      "pattern": "^[a-z][A-Za-z0-9:-]{0,63}$"
    },
    "hostname": {
      "type": "string",
      "pattern": "^(?=.{1,253}$)(?:[A-Za-z0-9](?:[A-Za-z0-9-]{0,61}[A-Za-z0-9])?\\.)+[A-Za-z0-9](?:[A-Za-z0-9-]{0,61}[A-Za-z0-9])?$"
    }
  }
}
