{
  "project": {
    "displayName": "WeiG-OpenWrt-AutoBuild",
    "shortName": "Wei.G",
    "repository": "andyhang1980/WeiG-OpenWrt-AutoBuild",
    "blogUrl": "https://www.weigshare.com/",
    "guideUrl": "https://weigshare.com/posts/WeiG-OpenWrt-AutoBuild-Guide/"
  },
  "catalog": {
    "repository": "andyhang1980/WeiG-OpenWrt-Menuconfig-Catalog",
    "selection": {
      "sourcePriority": [
        "ImmortalWrt",
        "lede",
        "OpenWrt",
        "hanwckf"
      ],
      "defaultSource": "ImmortalWrt",
      "developmentBranches": [
        "main",
        "master"
      ],
      "preferredTarget": {
        "selectors": {
          "system": "x86",
          "subtarget": "64",
          "profile": "DEVICE_generic"
        }
      }
    },
    "loading": {
      "startup": [
        "menu",
        "menu:language",
        "package-mirrors"
      ],
      "idle": [
        "applications",
        "hidden",
        "help",
        "compatibility"
      ],
      "startupConcurrency": 3,
      "idleConcurrency": 1,
      "idleDelayMs": 15000
    }
  },
  "ui": {
    "defaultLanguage": "auto",
    "colorMode": "auto",
    "applicationCountAdvisory": { "warningAbove": 6, "dangerAbove": 10 }
  },
  "firmware": {
    "lanIp": "192.168.1.1",
    "timezone": {
      "zonename": "Asia/Shanghai",
      "timezone": "CST-8"
    },
    "theme": "luci-theme-argon",
    "ntp": {
      "preset": "cn",
      "servers": [
        "ntp.aliyun.com",
        "time1.cloud.tencent.com",
        "cn.ntp.org.cn",
        "cn.pool.ntp.org"
      ]
    },
    "packageMirror": "source-default"
  },
  "build": {
    "defaultTag": "anonymous"
  }
}
